{
  "$schema": "https://json-schema.org/draft/2020-12/schema",
  "$id": "https://lusora.dev/schemas/edit_plan.schema.json",
  "title": "EditPlan",
  "description": "The strict, compiled timeline. The renderer's ONLY input besides asset files. Fixed track set; richness lives in items.",
  "type": "object",
  "required": ["version", "video_id", "fps", "resolution", "tracks"],
  "additionalProperties": false,
  "properties": {
    "version": { "const": "1.0" },
    "video_id": { "type": "string", "minLength": 1 },
    "fps": { "type": "integer", "minimum": 1, "maximum": 120 },
    "resolution": {
      "type": "object",
      "required": ["width", "height"],
      "additionalProperties": false,
      "properties": {
        "width": { "type": "integer", "minimum": 16 },
        "height": { "type": "integer", "minimum": 16 }
      }
    },
    "tracks": {
      "type": "object",
      "required": ["visual", "overlays", "captions", "audio"],
      "additionalProperties": false,
      "properties": {
        "visual": {
          "type": "array",
          "minItems": 1,
          "items": { "$ref": "#/$defs/visualItem" },
          "description": "base items: contiguous, non-overlapping, starts at 0 (validator-enforced)"
        },
        "overlays": {
          "type": "array",
          "items": { "$ref": "#/$defs/overlayItem" },
          "description": "catalog component instances AND media overlays; may overlap each other and the base"
        },
        "captions": {
          "type": "object",
          "required": ["enabled", "items"],
          "additionalProperties": false,
          "properties": {
            "enabled": { "type": "boolean" },
            "preset": { "type": "string", "description": "caption style preset name from the theme" },
            "items": {
              "type": "array",
              "items": { "$ref": "#/$defs/captionItem" }
            }
          }
        },
        "audio": {
          "type": "object",
          "required": ["voiceover"],
          "additionalProperties": false,
          "properties": {
            "voiceover": { "$ref": "#/$defs/voiceoverItem" },
            "music": {
              "type": "array",
              "items": { "$ref": "#/$defs/musicItem" },
              "description": "background beds, one per mood span; may overlap by the style pack's crossfade"
            },
            "sfx": {
              "type": "array",
              "items": { "$ref": "#/$defs/sfxItem" },
              "description": "one-shots and short loops placed by the compiler against overlay entrances and transitions"
            }
          }
        }
      }
    }
  },
  "$defs": {
    "provenance": {
      "type": "object",
      "required": ["source", "path"],
      "additionalProperties": false,
      "properties": {
        "source": { "enum": ["library", "stock", "ai", "upload", "manual", "youtube", "archive"] },
        "id": { "type": ["string", "null"] },
        "provider": { "type": ["string", "null"] },
        "license": { "type": ["string", "null"] },
        "path": { "type": "string", "description": "relative to the video folder, e.g. clips/b12.mp4" },
        "score": { "type": ["number", "null"] },
        "query": { "type": ["string", "null"] }
      }
    },
    "itemBase": {
      "type": "object",
      "required": ["id", "start_s", "end_s"],
      "properties": {
        "id": { "type": "string", "minLength": 1 },
        "beat_id": { "type": ["string", "null"], "description": "which beat produced this item; null for hand-added items" },
        "locked": { "type": "boolean", "default": false, "description": "set true automatically by any manual timeline edit; per-beat recompile skips locked items" },
        "start_s": { "type": "number", "minimum": 0 },
        "end_s": { "type": "number", "exclusiveMinimum": 0 }
      }
    },
    "motion": {
      "type": "object",
      "required": ["type"],
      "additionalProperties": false,
      "properties": {
        "type": { "enum": ["none", "ken_burns"] },
        "direction": { "enum": ["in", "out"], "default": "in" },
        "pan": { "enum": ["center", "left", "right", "up", "down"], "default": "center" },
        "strength": { "type": "number", "minimum": 0, "maximum": 1, "default": 0.15 }
      }
    },
    "transition": {
      "type": "object",
      "required": ["type"],
      "additionalProperties": false,
      "properties": {
        "type": { "enum": ["cut", "crossfade", "fade", "fade_to_black", "whip", "zoom_through", "push", "wipe", "flash"] },
        "direction": {
          "enum": ["left", "right", "up", "down"],
          "description": "which way the picture MOVES, for the kinds that have one (push, whip, wipe) — `left` means the incoming shot enters from the right. Ignored by every other kind. Absent means `left`. The compiler alternates push and whip left/right so a run of them does not read as a slideshow."
        },
        "duration_s": { "type": "number", "exclusiveMinimum": 0, "maximum": 3, "default": 0.5 },
        "placed_by": {
          "enum": ["section_break", "filler", "overlay"],
          "description": "D95 — the compiler chose this transition from the style pack's `section_break`, `mix` or `per_component` (`overlay`), rather than a beat's `transition_out` or the pack's `default`. Provenance only; renderers ignore it. It is what lets the editor tell a placed transition from a stale human one: a beat that names no transition shows the placed one as-is, and falls back to the default otherwise."
        }
      },
      "description": "transition OUT of this item; consumes handles, never moves narrative cuts"
    },
    "visualItem": {
      "allOf": [{ "$ref": "#/$defs/itemBase" }],
      "type": "object",
      "required": ["id", "start_s", "end_s", "media_type", "asset"],
      "unevaluatedProperties": false,
      "properties": {
        "media_type": { "enum": ["video", "image", "avatar", "color"] },
        "asset": { "$ref": "#/$defs/provenance" },
        "in_offset_s": { "type": "number", "minimum": 0, "default": 0, "description": "trim start within the source file" },
        "motion": { "$ref": "#/$defs/motion" },
        "transition_out": { "$ref": "#/$defs/transition" },
        "mute": { "type": "boolean", "default": true },
        "speed": { "type": "number", "exclusiveMinimum": 0, "default": 1.0, "description": "playback rate multiplier for video assets; 1.0 = normal speed (Remotion path only — ffmpeg profile rejects speed != 1)" },
        "loop": {
          "type": "boolean",
          "default": false,
          "description": "video assets only: repeat the source from its trim start for as long as the item holds, instead of freezing on the last frame when the footage runs out (D55). Both renderers honour it."
        },
        "absorbed_beat_ids": {
          "type": "array",
          "items": { "type": "string" },
          "description": "beats whose aligned span was too short to hold on its own (style pack pacing.hold_floor_ratio) and which now play under THIS item's shot. Provenance only — an absorbed beat still owns its overlay and its mood; this is what tells the editor why beat b7 has no visual of its own."
        }
      }
    },
    "overlayItem": {
      "type": "object",
      "required": ["id", "start_s", "end_s", "kind"],
      "unevaluatedProperties": false,
      "properties": {
        "kind": { "enum": ["component", "media"] },
        "component": { "type": "string", "description": "catalog component name (kind=component)" },
        "props": { "type": "object", "description": "full, validated semantic props (kind=component)" },
        "template": {
          "enum": ["card", "lower_third", "big_number", "bullet_list", "statement"],
          "description": "template kind copied from the catalog entry at compile time (kind=component with no React implementation)"
        },
        "asset": { "$ref": "#/$defs/provenance" },
        "transform": {
          "type": "object",
          "additionalProperties": false,
          "properties": {
            "scale": { "type": "number", "exclusiveMinimum": 0, "maximum": 1, "default": 0.35 },
            "position": { "enum": ["top_left", "top_right", "bottom_left", "bottom_right", "center"], "default": "bottom_right" }
          },
          "description": "PiP transform for media overlays"
        }
      },
      "allOf": [
        { "$ref": "#/$defs/itemBase" },
        {
          "if": { "properties": { "kind": { "const": "component" } } },
          "then": { "required": ["component", "props"] }
        },
        {
          "if": { "properties": { "kind": { "const": "media" } } },
          "then": { "required": ["asset"] }
        }
      ]
    },
    "captionItem": {
      "type": "object",
      "required": ["start_s", "end_s", "text"],
      "additionalProperties": false,
      "properties": {
        "start_s": { "type": "number", "minimum": 0 },
        "end_s": { "type": "number", "exclusiveMinimum": 0 },
        "text": { "type": "string" },
        "in_effect": { "enum": ["fade", "pop", "slide_up", null], "default": null, "description": "per-item entrance animation (Remotion path only)" },
        "out_effect": { "enum": ["fade", "pop", "slide_down", null], "default": null, "description": "per-item exit animation (Remotion path only)" },
        "bottom_fraction": {
          "type": "number",
          "minimum": 0,
          "maximum": 0.9,
          "description": "D56 — where this caption sits, as a gap from the bottom edge in fractions of frame height. Written by the compiler when a graphic occupies the caption band for this caption's span (from the catalog's `region`), so the decision is deterministic, visible in the plan and editable. Absent = the renderer's own resting position. Remotion only: the ffmpeg path burns one subtitle style for the whole video, and a plan with component overlays routes to Remotion anyway."
        }
      }
    },
    "voiceoverItem": {
      "type": "object",
      "required": ["path", "duration_s"],
      "additionalProperties": false,
      "properties": {
        "path": { "type": "string" },
        "start_s": { "type": "number", "minimum": 0, "default": 0, "description": "voiceover start offset (leading timed beats / cold opens)" },
        "duration_s": { "type": "number", "exclusiveMinimum": 0, "description": "must match real audio duration; start_s + duration_s defines total video duration" },
        "volume": { "type": "number", "minimum": 0, "maximum": 2, "default": 1 }
      }
    },
    "musicItem": {
      "type": "object",
      "required": ["path", "start_s"],
      "additionalProperties": false,
      "properties": {
        "id": { "type": "string", "minLength": 1, "description": "stable handle for edit ops; absent on hand-written pre-D48 plans, which address music by index" },
        "path": { "type": "string" },
        "start_s": { "type": "number", "minimum": 0 },
        "end_s": { "type": ["number", "null"] },
        "volume": { "type": "number", "minimum": 0, "maximum": 1, "default": 0.12 },
        "loop": { "type": "boolean", "default": false },
        "fade_in_s": { "type": "number", "minimum": 0, "default": 0 },
        "fade_out_s": { "type": "number", "minimum": 0, "default": 0 },
        "mood": { "$ref": "#/$defs/mood", "description": "the mood span this bed answers; carried for the editor and for recompile merging" },
        "gain_envelope": { "$ref": "#/$defs/gainEnvelope" },
        "asset": { "$ref": "#/$defs/provenance" }
      }
    },
    "sfxItem": {
      "allOf": [{ "$ref": "#/$defs/itemBase" }],
      "type": "object",
      "required": ["id", "start_s", "end_s", "path"],
      "unevaluatedProperties": false,
      "properties": {
        "path": { "type": "string", "description": "relative to the video folder, e.g. audio/swoosh-soft.mp3" },
        "gain": { "type": "number", "minimum": 0, "maximum": 1, "default": 0.35 },
        "cue": { "type": "string", "description": "cue name in the sound pack that produced this item" },
        "origin": {
          "enum": ["overlay", "transition", "manual"],
          "description": "why this cue exists — the editor shows it, and a manual item survives recompile"
        },
        "origin_id": { "type": ["string", "null"], "description": "id of the overlay or visual item this cue belongs to" },
        "loop": { "type": "boolean", "default": false, "description": "loop cues (a typing bed) fill their window; one-shots do not" },
        "fade_in_s": { "type": "number", "minimum": 0, "default": 0 },
        "fade_out_s": { "type": "number", "minimum": 0, "default": 0 },
        "asset": { "$ref": "#/$defs/provenance" }
      }
    },
    "gainEnvelope": {
      "type": "array",
      "minItems": 2,
      "maxItems": 200,
      "description": "piecewise-linear absolute-time gain multiplier, computed by the compiler from real sentence timings (D48 ducking). Multiplies `volume`. Points are ordered by t_s; the value before the first and after the last point is held flat.",
      "items": {
        "type": "object",
        "required": ["t_s", "gain"],
        "additionalProperties": false,
        "properties": {
          "t_s": { "type": "number", "minimum": 0 },
          "gain": { "type": "number", "minimum": 0, "maximum": 1 }
        }
      }
    },
    "mood": {
      "enum": [
        "neutral",
        "tense",
        "somber",
        "hopeful",
        "urgent",
        "triumphant",
        "reflective",
        "playful"
      ]
    }
  }
}
